{
  "apiVersion": "edgeai.vd/v2",
  "type": "processing",
  "serviceProfileVersionId": "11111111-1111-4111-8111-111111111111",
  "sources": {
    "input": {
      "deviceModel": "edgeai-model-temperature",
      "required": true
    }
  },
  "state": {
    "mode": "STATELESS"
  },
  "runtime": {
    "maxConcurrentTasks": 1,
    "startupTimeoutSeconds": 120,
    "drainTimeoutSeconds": 120
  }
}
